{
  "academic_sources_changed": [],
  "agents": [
    {
      "role": "harness_worker",
      "status": "completed",
      "summary": "명시 목적·속성 계획과 자연어 경로 구현; 작성자 관련171검사 통과는 독립 완료의 대체가 아님.",
      "task_id": "20261001-purpose-dialogue-repair5/backend"
    },
    {
      "role": "harness_worker",
      "status": "completed",
      "summary": "한 본문/접힌 상세/PDF 버튼 구현; 입력/결과 지문과 실제 종료 확인.",
      "task_id": "20261001-purpose-dialogue-ui-v1/ui"
    },
    {
      "role": "academic_student_question_generator",
      "status": "completed",
      "summary": "학생 질문40사례/66발화 생성. 별도 질문은 구현 담당에게 전달하지 않았고 정답/학사 승인을 만들지 않음.",
      "task_id": "20261001-purpose-dialogue-questions-v2/questions"
    },
    {
      "role": "harness_qa",
      "status": "completed",
      "summary": "29규칙·3출처·43과목의 승인 값/해시/위치로 독립 기대값과 판정기 동결.",
      "task_id": "20261001-purpose-grader5-v1/oracle"
    },
    {
      "role": "harness_worker_readonly_review_fallback",
      "status": "failed",
      "summary": "새 리뷰 세션 생성 한도 실패 후 비작성 부분을 기존 담당이 읽기 전용 교차 검토. 실제 자동 읽기 전용 권한을 주장하지 않음. 필수6지적.",
      "task_id": "20261001-purpose-backend-review5-v1/review"
    },
    {
      "role": "harness_qa",
      "status": "failed",
      "summary": "기존 목적30검사 통과, 새 원문 기반6경계 검사 실패. 제품 수정 없이 실행 결과를 등록.",
      "task_id": "20261001-purpose-qa-execution5-v1/qa_execution"
    },
    {
      "role": "harness_worker_test_only",
      "status": "completed",
      "summary": "낡은 레거시 예시/고정포트 테스트만 실제 의미 API와 독립 네이티브 포트로 보정. 제품 파일은 그대로.",
      "task_id": "20261001-purpose-fixture-maintenance5-v1/fixtures"
    },
    {
      "role": "harness_qa",
      "status": "failed",
      "summary": "최종66관찰36/29/1독립 판정. 이전 수정용25/10/1유지, 추가 모델 호출/재생/제품 변경 없이 실제 종료 확인.",
      "task_id": "20261001-purpose-actual-grading5-final-v1/grading"
    }
  ],
  "changes": [
    {
      "kind": "added",
      "path": "src/academic_assistant/assistant.py",
      "summary": "제한된 의미 계획과 목적별 조회, 후속 문맥, 전체 요건/개수/이수 의무 처리 경로. 독립 실패6건은 남음."
    },
    {
      "kind": "added",
      "path": "src/academic_assistant/semantic_llm.py",
      "summary": "Gemma 계획/문장 생성과 짧은 근거 참조 복원. 호출·시간·크기 예산 유지."
    },
    {
      "kind": "added",
      "path": "src/academic_assistant/courses.py",
      "summary": "과목명·별칭·학수번호 인식과 학점/구분/편성/목록 조회. 기존 질문 문장 열거 방식과 구분."
    },
    {
      "kind": "added",
      "path": "knowledge/course-catalogue.json",
      "summary": "승인 교육과정의 정확한 원문 위치로 직접 검증한43과목. 새 학사 규칙을 승인한 것은 아님."
    },
    {
      "kind": "changed",
      "path": "src/academic_assistant/web/semantic-ui.js",
      "summary": "한 답변을 먼저 보여주고 과목/규칙/계산 상세는 접음. PDF버튼·취소·새 대화의 메모리 초기화 유지."
    },
    {
      "kind": "added",
      "path": "src/academic_assistant/web/examples",
      "summary": "초기·130학점이지만 논문 미이수·재수강 포함의 실제 가상 PDF3종을 한 번 클릭해 인식/비교."
    },
    {
      "kind": "added",
      "path": "tests/test_purpose_dialogue_qa.py",
      "summary": "원문 숫자·조건·복합 요구 검증과 실패6건의 재현을 저장. 실패를 생략/완화하지 않음."
    },
    {
      "kind": "changed",
      "path": "tests/test_public_demo_transport.py",
      "summary": "사용 중인 공개 포트 대신 독립 임시 포트에서 실제 네이티브 자식/TCP/종료 검증."
    },
    {
      "kind": "added",
      "path": ".agents/skills/academic-student-question-evaluation/SKILL.md",
      "summary": "학생 관점 질문 생성/독립 평가/수정/미사용 질문 재평가와 누적 수정 상한."
    },
    {
      "kind": "documentation",
      "path": "docs/harness/decisions/0024-purpose-aware-dialogue-and-resume.md",
      "summary": "이전 실패를 보존한 누적5회 상한, 실패 분류, 마지막 필수 실패 뒤 미완료 종료."
    },
    {
      "kind": "documentation",
      "path": "reports/evaluations/20261001-purpose-dialogue.json",
      "summary": "실제66발화의 통과/실패/대기, 실제 답변·인용 평가, 혼재 조건과 변경61파일 목록."
    },
    {
      "kind": "documentation",
      "path": "reports/presentation-handoff-20261001.md",
      "summary": "공개 기존 실행 유지, 새 작업본 미승격, 남은6결함과 새 수정 범위의 재개 순서."
    }
  ],
  "checks": [
    {
      "command": "python -X utf8 -B -m unittest discover -s tests -p test_*.py",
      "evidence": "실제 780개,774통과·6실패·오류0·생략0,62.363초. 새 원문 기반 R5-F1~F6만 실패. 옛 예시/고정포트3건은 실제 의미API/독립 포트 검사로 정리했다. 이전773/3실패 및779/9실패는 보존했다.",
      "name": "최종 전체 회귀",
      "required": true,
      "status": "failed"
    },
    {
      "evidence": "정렬·근거뷰어·성적표 수명·Gemma표시·대화·의미조회 Node6명령 모두 종료0. 모의HTTP이며 실제 모델 정확도로 취급하지 않는다.",
      "name": "브라우저 소비자 회귀",
      "required": true,
      "status": "passed"
    },
    {
      "evidence": "최종 비공개 서버 브라우저에서6행15학점/부족115,45행130학점/부족0·논문미이수,7행9학점/부족121확인. PDF577/인쇄569의기초교양9정확한교차위치 빨간밑줄·복사본버튼확인. 새대화로 이수내역/입력초기화확인.",
      "name": "실제 가상 PDF3종과 근거 표시",
      "required": true,
      "status": "passed"
    },
    {
      "evidence": "승인된 추가 합성 브라우저1턴: 컴퓨터구조는몇학점이야? → 컴퓨터구조는3학점입니다. Gemma질문이해/근거조회/자연어표시와 접힌1과목상세·전용PDF버튼확인. API66평가와별도이며모든질문성공보증아님.",
      "name": "실제 화면의 기본 과목 질문",
      "required": true,
      "status": "passed"
    },
    {
      "evidence": "최종14:30UTC 계정검증·가동·GPU·디스크읽기검사, GPU0모델상주18776MiB/util0, 보호GPU1나루18510MiB/util0, 처음/끝 보호프로세스레코드동일. 기존승인상주서비스유지, 새서비스생성/종료없음. 성능영향은정량측정하지않았다. 합성추론71턴/상한96,원격학생기록전송없음. 승인평가시간종료후새추론없음.",
      "name": "서버·GPU분리 사후 확인",
      "required": true,
      "status": "passed"
    },
    {
      "command": "python -m pip wheel . --no-deps --wheel-dir .local/purpose-wheel5",
      "evidence": "실제0.11.0wheel 생성, 웹자산11개/가상PDF3개·OCR스크립트 원본바이트일치. 첫no-build-isolation은hatchling없어실패했고 표준격리빌드재시도는성공. 시스템패키지변경없음.",
      "name": "배포 패키지와 예제 자산",
      "required": true,
      "status": "passed"
    },
    {
      "evidence": "하네스10역할/9스킬구조, manifest/TOML/스킬/스키마/설계동기화,학사지식·질문권한·미검증후보격리실제통과. 승인29규칙·3출처·43과목과기존보류불변.",
      "name": "계약·하네스·승인·조사 격리",
      "required": true,
      "status": "passed"
    },
    {
      "evidence": "결정적엔진265·기존사용성30·신규합성참고15사례통과. 성적표5계약/95중첩패킷검증통과. 교수님챗봇UAT원시JSON은이번제품평가로사용하지않았고사람UAT는사용자요청으로생략.",
      "name": "기존 결정적 엔진과 성적표 검증",
      "required": true,
      "status": "passed"
    },
    {
      "evidence": "로컬mmdc실행파일없음. 유닛의모의렌더를실제전체다이어그램검사로취급하지않는다. GitHub CI의핀고정렌더단계는별도이며실제결과를후속기록한다.",
      "name": "Mermaid실제전체렌더",
      "required": true,
      "status": "not_run"
    },
    {
      "evidence": "저장된 실제 HTTP 응답 40사례/66발화, 통과36·실패29·판정대기1·미실행0. 수정용25/10/1, 미사용 별도11/19/0. 원시 제품 실패 표시26건과 수집기/판정기 혼재3건을 구분하고 실패를 통과로 바꾸지 않았다. 생성34·대체21·미적용11은 정확도 증명이 아니다.",
      "name": "실제 Gemma 질문 독립 평가",
      "required": true,
      "status": "failed"
    },
    {
      "evidence": "비작성 부분 교차 리뷰와 실제 QA의 R5-F1~F6에서 근거 숫자/조건의 변조 또는 복합 요구 누락을 재현. 제어된 비신뢰 모델 출력 검사이며 실제 Gemma가 같은 문장을 생성했다고 주장하지 않는다.",
      "name": "독립 원문 경계 검증",
      "required": true,
      "status": "failed"
    },
    {
      "evidence": "구현2c644c07의 Actions36879345919/job110426827705: Linux780개,통과768·실패6·플랫폼 생략6. Windows와 같은 R5-F1~F6 실패. 후속 배포/문서/실제 Mermaid 렌더 단계는 생략돼 통과라고 기록하지 않는다.",
      "name": "GitHub 구현 커밋 CI",
      "required": true,
      "status": "failed"
    },
    {
      "evidence": "동결 원문 기대값과 실제66응답 지문을 대조해 질문·기대값·실제 답변·실패 유형·혼재 경계를 공개 평가MD/JSON에 허용 목록으로 기록. 원시 요청·모델 지시·서버 접속값·학생 성적표는 제외. 구현 변경61파일 전체 목록과 기준/구현 SHA를 연결.",
      "name": "정제 평가 기록",
      "required": true,
      "status": "passed"
    },
    {
      "evidence": "동일 CompletionReport 입력에서 MD/JSON/PDF를 생성하고 A4 4페이지를 실제 PNG로 렌더링해 전 페이지 확인. 한글·표 반복 머리글·줄바꿈·잘림/겹침·고아 페이지 없음과 실행ID/페이지1~4 확인. PDF 생성/시각 검수 성공은 제품의 필수6결함 통과를 의미하지 않는다. 최종 재생성본도 전 페이지 재검수한다.",
      "name": "동일 입력 PDF 전 페이지 검수",
      "required": true,
      "status": "passed"
    }
  ],
  "git": {
    "base_commit": "1d22f14e39651438f3a1eeb4008eada5d3c9c61a",
    "branch": "codex/semantic-prototype",
    "head_commit": "2c644c07b8a1555007ead475b327bcd9e6865062"
  },
  "harness_version": "1.0.0 / upstream79b82281d305c89181fbb216499d5f1e962c14ed / prototype0.11.0",
  "issues": [
    {
      "message": "R5-F1: 균형교양 영역별 최소1을3으로 변조한 문장 허용",
      "owner": "next_product_repair",
      "severity": "error"
    },
    {
      "message": "R5-F2: 과목 학점+이수의무에서 학점 누락을 supported로 표시",
      "owner": "next_product_repair",
      "severity": "error"
    },
    {
      "message": "R5-F3: 졸업요건 전체+과목 학점의 속성 누락",
      "owner": "next_product_repair",
      "severity": "error"
    },
    {
      "message": "R5-F4: 전필/전선 개수 요청에9/34숫자 없이 분류만 반환",
      "owner": "next_product_repair",
      "severity": "error"
    },
    {
      "message": "R5-F5: 심층상담 최소1과 매학기 권장사항의 의무 혼동",
      "owner": "next_product_repair",
      "severity": "error"
    },
    {
      "message": "R5-F6: 캡스톤II PASS 선행조건의 부정을 잘못 허용",
      "owner": "next_product_repair",
      "severity": "error"
    },
    {
      "message": "누적5회 수정 상한이 끝났으므로 숨겨 여섯 번째 제품 수정을 수행하지 않았다. 다음 범위를 명시하고 위6건의 원문 조건/요구 완전성부터 고친 뒤 기존 및 미사용 질문을 재검증해야 한다.",
      "severity": "warning"
    },
    {
      "message": "원시 실패29건을 전부 환각/틀린 학사 사실로 해석하지 않는다. R18T2/H03T2/H06T2의 수집기/판정기 혼재3건과 문맥·요청 누락·범위/메타데이터 차이를 그대로 기록했다.",
      "severity": "warning"
    },
    {
      "message": "기존 공개 시연은 유지했으며 이번 필수 실패 작업본은 승격하거나 병합하지 않았다. Draft PR12에서 코드/보고서를 보관한다. 최종 제품 완료가 아니다.",
      "severity": "warning"
    },
    {
      "message": "사용자에게 이미 승인한 학사 사실을 다시 설명받을 필요는 없다. 기존 보류는 유지하고 결함은 구현에서 고친다. 실제 학생 성적표/이수내역은 모델에 보내지 않았다.",
      "severity": "info"
    }
  ],
  "publication": {
    "major": true,
    "pdf_required": true,
    "reason": "질문 처리·공개 인터페이스·하네스·보고 변경의 주요 작업 검증 기록. 제품 완료가 아니라 필수 실패/미실행을 보존한 미완료 마일스톤 보고."
  },
  "request": "졸업요건·복합 질문, 과목 목적/별칭/후속 질문, 화면 단순화, 실제 모델/브라우저 평가, 독립 QA·리뷰·보고·GitHub 반영의 다섯 단계를 진행한다.",
  "run_id": "20261001-purpose-dialogue",
  "schema_version": "1.0.0",
  "summary": "Gemma 질문 계획→승인 그래프 조회→검증된 자연어 경로와 단순 화면을 추가했다. 컴퓨터구조3학점은 실제 화면에서 답했고 가상 PDF3종 및 원문 빨간 밑줄을 확인했다. 하지만 실제66발화는36통과·29실패·1대기, Windows 전체780중774통과·6실패이며 GitHub도 같은6건에 실패했다. 누적5회 뒤 필수 실패를 보존해 미완료로 보고한다. 승인29규칙·3출처·43과목과 보류는 불변이고 기존 공개 서버를 유지했다. 구현 기준과 보고서 발행 커밋은 구분한다.",
  "title": "목적별 학사 대화 구현·검증 결과 — 미완료"
}
